{
  "sourceServerID": "s-1234567890abcdef0",
  "name": "Default replication configuration",
  "stagingAreaSubnetId": "subnet-1234567890abcdef0",
  "associateDefaultSecurityGroup": true,
  "replicationServersSecurityGroupsIDs": [],
  "replicationServerInstanceType": "t3.small",
  "useLowBandwidthForReplication": false,
  "dataPlaneRouting": "PRIVATE_IP",
  "createPublicIP": false,
  "stagingAreaTags": {},
  "replicatedDisks": [],
  "bandwidthThrottling": 0,
  "defaultLargeStagingDiskType": "GP2",
  "ebsEncryption": "DEFAULT",
  "ebsEncryptionKeyArn": "arn:aws:kms:us-east-1:123456789012:key/12345678-1234-1234-1234-123456789012"
}